REGISTRO_ANS;RAZAO_SOCIAL;UF
424561;NOVAMED PLANOS DE SAUDE LTDA;GO
417840;NOVODENTE SA;RS
352888;NUCLEBRAS EQUIPAMENTOS PESADOS SA NUCLEP;RJ
422754;ODILE SERVIAOS DE SAADE LTDA;SP
422088;ODONTOPERADORA ODONTOLOGICA LTDA;SP
421464;ODONTO ALEGRE CLINICAS E PLANOS ODONTOLOGICOS LTDA;RS
310981;ODONTO EMPRESAS CONVENIOS DENTARIOS LTDA;SP
312321;ODONTO JARAGUA LTDA;SC
406414;ODONTO LIFE ASSISTANCIA ODONTOLAGICA SA;PR
422851;ODONTO MAIS BRASIL OPERADORA DE PLANOS ODONTOLOGICO LTDA;AM
422622;ODONTO MAIS SAUDE EMPREENDIMENTOS LTDA;MG
405671;ODONTO PLUS CONVENIO ODONTOLOGICO SOCIEDADE SIMPLES LTDA;RS
418994;ODONTO PRIME SS LTDA;CE
419281;ODONTO SEG OPERADORA DE PLANOS ODONTOLOGICOS SA;SP
414387;ODONTOART PLANOS ODONTOLAGICOS LTDA;CE
344486;ODONTOBASE PLANOS DE SAUDE LTDA;SP
423491;ODONTOBRAS PLANOS ODONTOLOGICOS LTDA;SP
418111;ODONTOCLINICA RCC LTDA SS;RS
422924;ODONTOCOOP OPERADORA DE PLANOS DE SAADE LTDA;AL
389854;ODONTOGROUP SISTEMA DE SAADE LTDA;DF
417831;ODONTOLIVE OPERADORA DE PLANOS ODONTOLAGICOS LTDA;SP
419184;ODONTOMAIS SERVIAOS ODONTOLAGICOS LTDA ME;RN
419583;ODONTOMAXI OPERADORA DE PLANOS ODONTOLAGICOS LTDA;SP
301949;ODONTOPREV SA;SP
412040;ODONTOREAL LTDA;PE
416738;OESTE SAADE ASSISTANCIA A SAADE SUPLEMENTAR SA;SP
422185;OLIVA ADMINISTRADORA DE BENEFICIOS LTDA;RJ
424030;OMEGA ODONTO OPERADORA DE PLANOS ODONTOLOGICOS LTDA;SP
359661;OMINT SERVIAOS DE SAADE SA;SP
304212;ON MED ASSISTANCIA MADICA LTDA;RS
422673;OPERADORA DE PLANOS ODONTOLOGICOS ULTRAODONTO LTDA;BA
420743;OPERADORA DE PLANOS ODONTOLAGICOS ODONTOCLANICA LTDA;RN
419699;OPERADORA DE PLANOS PRIVADOS DE SAADE SANTA CASA SAADE LTDA;MS
318477;OPERADORA UNICENTRAL DE PLANOS DE SAADE LTDA;SP
354511;OPERADORA UNIESTE DE PLANOS DE SAADE LTDA;RJ
418226;OPLAN SAADE OPERADORA DE PLANO DE SAADE LTDA;RJ
418200;ORAL BLUE LTDA;PA
418447;ORAL GAM ASSISTENCIA ODONTOLAGICA LTDA;SP
366510;ORAL SAADE DE IBITINGA SERVIAOS ODONTOLAGICOS SS LTDA;SP
412996;ORALE ASSISTANCIA ODONTOLAGICA LTDA;BA
420972;ORALPLAN PLANOS DE SAUDE ODONTOLAGICOS LTDA;AL
404772;ORION ODONTOLOGIA LTDA;SP
416371;ORION PLANOS E SERVIAOS ODONTOLAGICOS LTDA;SP
419991;OROS OPERADORA DE PLANOS ODONTOLAGICOS LTDA ME;ES
423483;P4H GESTAO DE BENEFICIOS LTDA;SC
315265;PARANA ASSISTENCIA MEDICA LTDA;PR
415782;PARRA ODONTOLOGIA LTDA;SP
331988;PASA PLANO DE ASSISTENCIA A SAUDE DO APOSENTADO DA VALE;RJ
420778;PASSPORT SYSTEM ODONTOLOGIA LTDA;RO
422584;PB ASSISTENCIA MEDICA EU LTDA;BA
422355;PD BRASIL ASSISTENCIA ODONTOLOGICA LTDA;MG
421774;PENTAGONO ADMINISTRADORA DE BENEFACIOS SA;PR
421707;PERSONAL CARE OPERADORA DE SAADE SA;SP
310239;PESSOAL SAADE PLANOS DE ASSISTANCIA MADICA LTDA;SP
419486;PLADISA PLANOS DE SAADE SA;SC
343463;PLAMED PLANO DE ASSISTENCIA MEDICA LTDA;SE
413551;PLAMEDH PLANO DE ASSISTANCIA MADICOHOSPITALAR LTDA;MG
423882;PLAMEDH PLANOS DE SAADE LTDA;MG
324299;PLAMER PLANO MEDICO RESENDE LTDA;RJ
419974;PLAMESC PLANOS DE SAADE LTDA;RJ
424200;PLANO A ADMINISTRADORA DE PLANOS DE SAUDE LTDA;AM
363391;PLANO ASSISTENCIAL SAO LUCAS LTDA;MG
382281;PLANO DE ASSISTANCIA MADICA MINEIRA LTDA;MG
417106;PLANO DE ASSISTANCIA ODONTOLAGICA FAUCHARD LTDA ME;BA
411582;PLANO DE SAUDE ASES LTDA;RJ
360244;PLANO DE SAADE ANA COSTA LTDA;SP
420166;PLANO DE SAADE DA SANTA CASA DE BRAGANAA PAULISTA;SP
411256;PLANO HOSPITAL SAMARITANO LTDA;SP
415936;PLANO ODONTOLAGICO DENTALVIDAS LTDA;SP
423408;PLANO SIGMA SAADE LTDA;SP
415987;PLANO VIDA SAUDE SERVIAOS ODONTOLOGICOS LTDA;SE
416517;PLANODENTE LTDA;MG
418986;PLATINUM ADMINISTRADORA DE BENEFICIOS;DF
420956;PLENA ADMINISTRADORA DE BENEFACIOS LTDA ME;ES
348830;PLENA SAADE SA;SP
403458;PLENODONTO ASSISTANCIA ODONTOLAGICA LTDA;SP
423441;PLENUM ASSISTENCIA MEDICA LTDA;DF
418552;PLURAL GESTAO EM PLANOS DE SAADE LTDA;RJ
417751;PLURICLUB ADMINISTRADORA DE BENEFACIOS LTDA;SP
351270;POLI SAUDE OPERADORA DE PLANO DE SAUDE LTDA;PR
415693;POLICLIN SAADE SA;SP
316903;POLIMADICA SAADE SOCIEDADE SIMPLES LTDA;RS
415081;PORTO DIAS SAUDE LTDA;PA
582;PORTO SEGURO SEGURO SAADE SA;SP
418625;PORTO SEGURO SERVIAOS ODONTOLAGICOS LTDA;SP
417491;PORTOMED PORTO SEGURO SERVIAOS DE SAUDE LTDA;SP
420280;POSITIVA ADMINISTRADORA DE BENEFICIOS LTDA;SP
419133;POSTAL SAADE CAIXA DE ASSISTANCIA E SAADE DOS EMPREGADOS DOS CORREIOS;DF
421413;PP HEALTH ADMINISTRADORA DE BENEFACIOS LTDAME;PR
422959;PRESERVE SAUDE ASSISTENCIA MEDICA LTDA;BA
384844;PREST ODONTO LTDA;SP
413267;PREVENT SENIOR CORPORATE OPERADORA DE SAADE LTDA;SP
302147;PREVENT SENIOR PRIVATE OPERADORA DE SAADE LTDA;SP
421804;PREVER ADMINISTRADORA DE BENEFACIOS LTDA;PR
374440;PREVIDENT ASSISTANCIA ODONTOLAGICA SA;SP
403636;PREVINA ODONTOLOGIA LTDA;SP
418307;PREVISAO ADMINISTRADORA DE BENEFACIOS LTDA;RJ
416525;PRIMA VIDA ODONTOLOGIA DE GRUPO LIMITADA;RJ
424617;PRIME PLANOS DE SAUDE LTDA;AM
424161;PROSAUDE JARINU ASSISTENCIA MEDICA SUPLEMENTAR LTDA;SP
310522;PROASA SAADE;DF
424251;PROLIFE ADMINISTRADORA DE SAUDE LTDA;SP
326861;PROMADICA PROTEAAO MEDICA A EMPRESAS SA;BA
417475;PRONTO SOCORRO CONDE DE MOREIRA LIMA;SP
305626;PRONTOCLINICA E HOSPITAIS SAO LUCAS SA;MG
301728;PRONTOMED PLANOS DE SAADE LTDA;MG
421383;PROPULSAO PLANOS ODONTOLAGICOS LTDA;PR
422533;PROVER ODONTOLOGIA LTDA;MS
423998;PROVIDENCE ADMINISTRADORA DE BENEFICIOS LTDA;RJ
422193;PRUDENTE ADMINISTRADORA DE BENEFICIOS LTDA;SP
424641;PRASAADE ADMINISTRADORA DE BENEFICIOS LTDA;RJ
422703;PS ASSISTENCIA LTDA;ES
420999;QUALI ADMINISTRADORA DE BENEFACIOS SA;ES
417173;QUALICORP ADMINISTRADORA DE BENEFACIOS SA;SP
419290;QUALICORP CLUBE DE SAADE ADMINISTRADORA DE BENEFACIOS LTDA;SP
417131;QUALIDONTO QUALIDADE EM ODONTOLOGIA LTDA;BA
421243;QUALITY GOLD SAADE ADMINISTRADORA DE PLANOS DE SAADE LTDAME;RJ
418170;QUALLITY PRA SAADE PLANO DE ASSISTANCIA MADICA LTDA;DF
419389;QV BENEFACIOS EM SAADE LTDA;RJ
420271;RMI OPERADORA DE SAADE INTEGRADA LTDA;SP
418196;RAMED ADMINISTRADORA DE BENEFICIOS LTDA;SP
418862;RBS PARTICIPAAAES SA;RS
331317;REAL GRANDEZA FUNDAAAO DE PREVIDANCIA E ASSISTANCIA SOCIAL;RJ
423513;REAL GRANDEZA SAADE;RJ
418692;RESOLVE ADMINISTRADORA DE BENEFACIOS LTDA;PI
422878;RG SAADE ADMINISTRADORA DE BENEFICIOS LTDA;SP
417149;RIBERDENTE SERVIAOS ODONTOLAGICOS SS LTDA;SP
421359;RIO DOCE SAADE;ES
415243;RODRIGUES LEIRA ODONTOLOGIA LTDA;SP
415821;ROPE ODONTOLOGIA ESPECIALIZADA SS LTDA;SP
324493;SPA SAUDE SISTEMA DE PROMOAAO ASSISTENCIAL;SP
420981;S1 OPERADORA DE PLANO DE SAADE LTDA;DF
418439;SAFE LIFE ADMINISTRADORA DE BENEFACIOS LTDA;SP
423815;SAGRADA SAADE ASSISTANCIA MADICA LTDA;MG
419567;SALUPLAN ADMINISTRADORA DE BENEFACIOS LTDA;SP
422746;SALUSMED OPERADORA DE PLANOS DE SAUDE LTDA;SP
422860;SALUTY ADMINISTRADORA DE BENEFICIOS LTDA;RJ
424421;SALVE SAADE ADMINISTRADORA DE BENEFACIOS LTDA;RJ
415901;SAMESERVIAO DE ASSISTANCIA MADICA EMPRESARIAL LTDA;MA
335614;SAMEDIL SERVIAOS DE ATENDIMENTO MADICO SA;ES
367095;SAMEL PLANO DE SAADE LTDA;AM
422398;SAMI ASSISTANCIA MADICA LTDA;SP
340162;SAMIG SERV DE ASSISTENCIA MEDICA DA ILHA DO GOVERNADOR LTDA;RJ
343676;SAMOC SA SOCIEDADE ASSISTENCIAL MADICA E ODONTO CIRARGICA;RJ
342033;SAMP ESPIRITO SANTO ASSISTENCIA MEDICA SA;ES
408522;SANTA CASA DA MISERICARDIA DE SAO JOAO DEL REI;MG
421197;SANTA CASA DE MAUA SAADE;SP
345091;SANTA CASA DE MISERICORDIA DE SAO JOAQUIM DA BARRA;SP
353264;SANTA CASA DE MISERICORDIA HOSPITAL SAO VICENTE;SP
342807;SANTA CASA DE MISERICARDIA DE JUIZ DE FORA;MG
306045;SANTA CASA DE MISERICARDIA DE TUPA;SP
330116;SANTA CASA DE MISERICARDIA DE VOTUPORANGA;SP
344915;SANTA CASA DE MISERICARDIA E ASILO DOS POBRES DE BATATAIS;SP
422762;SANTA CASA DE MISERICARDIA E BENEFICANCIA PORTUGUESA;SP
420085;SANTA CASA DE SAADE SCS;ES
424404;SANTA CRUZ SAADE GESTAO EM PLANOS DE SAADE LTDA;MS
355097;SANTA HELENA ASSISTANCIA MADICA SA;SP
400190;SANTO ANDRA PLANOS DE ASSISTENCIA MADICA LTDA;SP
405582;SANTOS VIP ASSISTANCIA ODONTOLAGICA LTDA;AM
421758;SANUS ADMINISTRADORA DE BENEFACIOS LTDA;ES
424633;SAUDE FACIL PLANOS DE SAUDE LTDA;RJ
423106;SAUDE INTEGRAL ASSISTENCIA MEDICA LTDA;BA
409243;SAUDE PAS MEDICINA E ODONTO;RS
424463;SAUDE SALV ASSISTENCIA MEDICA LTDA;RO
424145;SAUDE VIVA ADMINISTRADORA DE BENEFICIOS LTDA;SP
423645;SAUDIA ASSISTENCIA MADICA LTDA;MG
421154;SAADE BRASIL ASSISTANCIA MADICA LTDA;SP
414310;SAADE BRB CAIXA DE ASSISTANCIA;DF
423394;SAADE PLENA ADMINISTRADORA DE BENEFACIOS LTDA;MG
414930;SAADE SANTA TEREZA LTDA;SP
412058;SBC SAADE LTDA;SP
421634;SDM OPERADORA DE PLANOS DE SAUDE LTDA;RJ
358053;SELECT OPERADORA DE PLANO DE SAUDE LTDA;GO
414654;SEMPRE ODONTO PLANOS ODONTOLOGICOS LTDA;RJ
407224;SEPACO SAADE LTDA;SP
303739;SERMEDSAADE LTDA;SP
424188;SERV SOCIAL AUTANOMO DE ASSIST A SAADE DOS SERV PABLICOS E MILITARES DE GOIAS;GO
414701;SERVDONTO PLANO DE ASSISTANCIA ODONTOLAGICA LTDA;SE
417602;SERVIX ADMINISTRADORA DE BENEFACIOS LTDA;DF
324710;SERVIAO DE ASSISTANCIA ODONTOLAGICA SOCIAL LTDA;SP
345474;SERVIAO FEDERAL DE PROCESSAMENTO DE DADOS SERPRO;DF
420077;SERVIAO SOCIAL DA INDASTRIA DO PAPEL PAPELAO E CORTIAA DO ESTADO DE SAO PAULO SEPACO;SP
424595;SF SAADE ASSISTANCIA MADICA LTDA;PE
423874;SF SAADE ODONTOMAIS ASSISTANCIA ODONTOLAGICA LTDA;PE
422371;SF SISTEMAS DE SAADE LTDA;SP
356476;SIM CAIXA DE ASSISTANCIA A SAADE;SC
361011;SINDIFISCO NACIONAL SINDICATO NACIONAL DOS AUDITORESFISCAIS DA RECEITA FEDERAL DO BRASIL;DF
344095;SISDENTE SISTEMA INTEGRADO DE SAADE DENTAL LTDA;MG
423556;SISO PLANO ODONTOLOGICO LTDA;SP
418790;SISTEMA 1 SERVIAOS DE ASSISTANCIA A SAADE SUPLEMENTAR;PR
403865;SISTEMA INTEGRADO DE SAUDE ORAL LTDAEPP;BA
333239;SISTEMA PREVSAUDE DENTAL LTDA;CE
402001;SISTEMA TOTAL DE SAADE LTDA;SP
352586;SISTEMAS E PLANOS DE SAADE LTDA;SP
402095;SITO SISTEMA INTEGRADO DE TRATAMENTO ODONTOLAGICO LTDA;SP
420051;SMART CARE SISTEMAS MADICOS E ODONTOLAGICOS LTDA;SP
423947;SMILES ODONTO LTDA;PR
326500;SOBAM CENTRO MADICO HOSPITALAR SA;SP
415898;SOCIEDADE BENECAP DE ASSISTANCIA A SAADE;DF
413721;SOCIEDADE BENEFICENTE DEZOITO DE JULHO;MG
411809;SOCIEDADE DE ASSISTANCIA MADICA SAMEISA;RS
413941;SOCIEDADE DE ASSISTANCIA ODONTOLOGICA DE GRUPORN DENTAL MED CENTERRN;RN
413372;SOCIEDADE PORTUGUESA DE BENEFICANCIA;RS
416410;SOCIODONTO PLANO DE ASSISTANCIA ODONTOLAGICA LTDA;MG
423068;SOLIDUS ADMINISTRADORA DE BENEFICIOS E SOLUCOES EM SAUDE LTDA;BA
415871;SOLIMEO ASSISTANCIA ODONTOLAGICA LTDA;SP
422291;SOLUTIONS ADMINISTRADORA DE BENEFICIOS LTDA;RJ
424153;SOMA ADMINISTRADORA DE BENEFICIOS LTDA;RJ
403245;SOPREVI SERVIAO ODONTOLAGICO PREVENTIVO INTEGRADO LTDA;RS
419524;SORRIDEN CONVANIOS ODONTOLAGICOS SA;SP
421472;SORRISO STUDIO PLANO DE SAUDE LTDA;SP
6246;SUL AMERICA COMPANHIA DE SEGURO SAADE;RJ
417815;SUL AMARICA ODONTOLAGICO SA;SP
416428;SUL AMARICA PARANA CLANICAS SERVIAOS DE SAADE SA;SP
423718;SUL DO PARA LTDA;PA
338346;SULMED ASSISTANCIA MADICA LTDA;RS
421405;SUPERMED ADMINISTRADORA DE BENEFACIOS LTDA;RJ
424498;SUPORTE ADMINISTRADORA DE BENEFICIOS LTDA;RJ
412252;SV SAUDE ADMINSTRADORES DE PLANO DE SAUDE LTDA;RJ
319180;SAO DOMINGOS SAADE ASSISTANCIA MADICA LTDA;SP
403962;SAO FRANCISCO ASSISTANCIA MADICA LTDA;PE
344362;SAO LUCAS SAADE SA;SP
421740;TECBEN ADMINISTRADORA DE BENEFICIOS LTDA;SP
316849;TELOS FUNDAAAO EMBRATEL DE SEGURIDADE SOCIAL;RJ
422771;TEMPO MED PLANO DE SAUDE LTDA;SC
412759;TERRAMAR ADMINISTRADORA DE PLANO DE SAUDE LTDA;BA
416193;TOP DOCTORS ODONTOLOGIA LTDA;SP
417114;TOPDONTO OPERADORA DE PLANO ODONTOLAGICO LTDA;BA
423548;TOTAL ASSISTANCIA MADICA HOSPITALAR LTDA;MG
423017;TOTAL SAUDE ADMINISTRADORA DE BENEFICIOS EIRELI;ES
422827;TRINO ALIANCA FILANTRAPICA DE ASSISTANCIA E INTEGRAAAO PARA O DESENVOLVIMENTO DA SAUDE;ES
418528;UNIBEN ADMINISTRADORA DE BENEFACIOS LTDA;MG
424501;UNIC ASSISTENCIA MEDICA LTDA;SP
420107;UNICONSULT ADMINISTRADORA DE BENEFICIOS E SERVICOS LTDA;SP
423041;UNICOR ADMINISTRADORA DE BENEFICIOS LTDA;MG
401072;UNIDENTAL COOPERATIVA UNIAO DOS DENTISTAS DO ESTADO DO CEARA;CE
413429;UNIDENTIS ASSISTENCIA ODONTOLOGICA LTDA;PB
404942;UNIFICAAAO DOS DENTISTAS DE ITUVERAVA LTDA;SP
385255;UNIHOSP SAADE LTDA;SP
306398;UNIMED COOPERATIVA DE SERVIAOS DE SAADE DOS VALES DO TAQUARI E RIO PARDO LTDA;RS
354996;UNIMED ALFENAS COOPERATIVA DE TRABALHO MEDICO;MG
324159;UNIMED ALTA MOGIANA COOPERATIVA DE TRABALHO MADICO;SP
343684;UNIMED ALTO DA SERRA SOCIEDADE COOPERATIVA DE SERVIAO MADICO LTDA;RS
352519;UNIMED ALTO JACUARS COOPERATIVA DE ASSISTANCIA A SAADE LTDA;RS
341819;UNIMED ALTO PARANAIBA COOPERATIVA DE TRABALHO MEDICO;MG
348261;UNIMED ALTO SAO FRANCISCO COOPERATIVA DE TRABALHO MADICO;MG
372561;UNIMED ALTO VALE COOPERATIVA DE TRABALHO MADICO;SC
345598;UNIMED AMPARO COOPERATIVA DE TRABALHO MADICO;SP
348082;UNIMED ANHANGUERA COOPERATIVA DE TRABALHO MADICO;SP
312347;UNIMED ANAPOLIS COOPERATIVA DE TRABALHO MADICO;GO
358096;UNIMED APUCARANA COOPERATIVA DE TRABALHO MADICO;PR
354325;UNIMED ARAGUARI COOPERATIVA DE TRABALHO MADICO;MG
335215;UNIMED ARARUAMA COOPERATIVA DE TRABALHO MADICO LTDA;RJ
331651;UNIMED ARAXA COOPERATIVA DE TRABALHO MADICO LTDA;MG
309087;UNIMED BARBACENA COOPERATIVA DE TRABALHO MADICO LTDA;MG
304468;UNIMED BARRA DO GARAAS COOPERATIVA DE TRABALHO MADICO;MT
343889;UNIMED BELO HORIZONTE COOPERATIVA DE TRABALHO MADICO;MG
303976;UNIMED BELAM COOPERATIVA DE TRABALHO MADICO;PA
334561;UNIMED BLUMENAU COOPERATIVA DE TRABALHO MEDICO;SC
323357;UNIMED CABO FRIO COOPERATIVA TRABALHO MADICO LTDA;RJ
350346;UNIMED CACERES COOPERATIVA DE TRABALHO MADICO;MT
344141;UNIMED CAJAZEIRAS SOCIEDADE COOPERATIVA DE TRABALHO MADICO;PB
343765;UNIMED CALDAS NOVAS COOPERATIVA DE TRABALHO MEDICO;GO
367397;UNIMED CAMPINA GRANDE COOPERATIVA DE TRABALHO MEDICO LTDA;PB
335690;UNIMED CAMPINAS COOPERATIVA DE TRABALHO MADICO;SP
367613;UNIMED CAMPO BELO COOPERATIVA DE TRABALHO MADICO;MG
312851;UNIMED CAMPO GRANDE MS COOPERATIVA DE TRABALHO MADICO;MS
347736;UNIMED CARATINGA COOPERATIVA DE TRABALHO MADICO LTDA;MG
340952;UNIMED CARUARUCOOPERATIVA DE TRABALHO MEDICO;PE
315648;UNIMED CATAGUASES COOPERATIVA DE TRABALHO MADICO LTDA;MG
346951;UNIMED CAAADOR COOPERATIVA DE TRABALHO MADICO DA REGIAO DO CONTESTADO;SC
357138;UNIMED CENTRO OESTE PAULISTA FEDERAAAO INTRAFEDERATIVA DAS COOPERATIVAS MADICAS;SP
414573;UNIMED CENTRO PAULISTA FEDERAAAO INTRAFEDERATIVA DAS COOPERATIVAS MADICAS;SP
347507;UNIMED CENTRO RONDANIA COOPERATIVA DE TRABALHO MADICO;RO
320897;UNIMED CENTRO SUL FLUMINENSE COOPERATIVA DE TRABALHO MADICO;RJ
354295;UNIMED CHAPECA COOPERATIVA DE TRABALHO MADICO DA REGIAO OESTE CATARINENSE;SC
345709;UNIMED CONSELHEIRO LAFAIETE COOPERATIVA DE TRABALHO MADICO LTDA;MG
324345;UNIMED COSTA DO DESCOBRIMENTO COOPERATIVA DE TRABALHO MADICO;BA
371106;UNIMED COSTA OESTE COOPERATIVA DE TRABALHO MADICO;PR
311146;UNIMED COSTA VERDE RJ;RJ
342084;UNIMED CUIABA COOPERATIVA DE TRABALHO MADICO;MT
304701;UNIMED CURITIBA SOCIEDADE COOPERATIVA DE MADICOS;PR
330108;UNIMED CURVELO COOPERATIVA DE TRABALHO MADICO LTDA;MG
311944;UNIMED DE ADAMANTINACOOPERATIVA DE TRABALHO MADICO;SP
303844;UNIMED DE ANDRADINA COOPERATIVA DE TRABALHO MADICO;SP
369411;UNIMED DE ARACATUBA COOPERATIVA DE TRABALHO MADICO;SP
364312;UNIMED DE ARARAQUARA COOP DE TRAB MADICO;SP
300713;UNIMED DE ASSIS COOPERATIVA DE TRABALHO MADICO;SP
304123;UNIMED DE AVARA COOPERATIVA DE TRABALHO MADICO;SP
330264;UNIMED DE BARRA MANSA SOC COOP SERVMEDE HOSPIT;RJ
347108;UNIMED DE BARRETOS COOPERATIVA DE TRABALHO MADICO;SP
313149;UNIMED DE BATATAIS COOPERATIVA DE TRABALHO MADICO;SP
369659;UNIMED DE BAURU COOPERATIVA DE TRABALHO MADICO;SP
331341;UNIMED DE BEBEDOURO COOPERATIVA DE TRABALHO MADICO;SP
345776;UNIMED DE BIRIGUI COOPERATIVA DE TRABALHO MADICO;SP
304883;UNIMED DE BOTUCATU COOPERATIVA DE TRABALHO MADICO;SP
348244;UNIMED DE BRUSQUE COOPERATIVA DE TRABALHO MADICO;SC
352683;UNIMED DE CAMPOS COOPERATIVA DE TRABALHO MADICO;RJ
366340;UNIMED DE CAPIVARI COOPERATIVA DE TRABALHO MADICO;SP
370070;UNIMED DE CASCAVEL COOPERATIVA DE TRABALHO MADICO;PR
324566;UNIMED DE CATALAO COOPERATIVA DE TRABALHO MADICO;GO
351407;UNIMED DE CATANDUVA COOPERATIVA DE TRABALHO MADICO;SP
334154;UNIMED DE CAAAPAVA COOPERATIVA DE TRABALHO MEDICO;SP
354627;UNIMED DE CIANORTE COOPERATIVA DE TRABALHO MEDICO;PR
344788;UNIMED DE CORUMBA COOPERATIVA DE TRABALHO MADICO;MS
329339;UNIMED DE CRICIAMA COOPERATIVA DE TRABALHO MADICO DA REGIAO CARBONAFERA;SC
333662;UNIMED DE DOURADOS COOPERATIVA DE TRABALHO MADICO LTDA;MS
314781;UNIMED DE DRACENA COOPERATIVA DE TRABALHO MADICO;SP
317144;UNIMED DE FORTALEZA SOCIEDADE COOPERATIVA MADICA LTDA;CE
355577;UNIMED DE GUARATINGUETACOOPERATIVA DE TRABALHO MADICO;SP
333051;UNIMED DE GUARULHOS COOPERATIVA DE TRABALHO MADICO;SP
365238;UNIMED DE IBITINGA COOPERATIVA DE TRABALHO MADICO;SP
329886;UNIMED DE JABOTICABAL COOP DE TRABALHO MADICO;SP
334847;UNIMED DE JATAA COOPERATIVA DE TRABALHO MADICO LTDA;GO
321273;UNIMED DE JOINVILLE COOPERATIVA DE TRABALHO MADICO;SC
325031;UNIMED DE LENAOIS PAULISTA COOPERATIVA DE TRABALHO MADICO;SP
301574;UNIMED DE LIMEIRA COOPERATIVA DE TRABALHO MADICO;SP
354279;UNIMED DE LINS COOPERATIVA DE TRABALHOS MADICOS;SP
343269;UNIMED DE LONDRINA COOPERATIVA DE TRABALHO MADICO;PR
385620;UNIMED DE LORENA COOPERATIVA DE TRABALHO MADICO;SP
302953;UNIMED DE MACAA COOPERATIVA DE ASSISTANCIA A SAADE;RJ
311961;UNIMED DE MANAUS COOP DO TRABALHO MADICO LTDA;AM
336106;UNIMED DE MARILIA COOPERATIVA DE TRABALHO MADICO;SP
357715;UNIMED DE MINEIROS COOPERATIVA DE TRABALHO MADICO;GO
328308;UNIMED DE MOCOCA COOPERATIVA DE TRAB MADICO;SP
309524;UNIMED DE MONTE ALTO COOPERATIVA DE TRABALHO MADICO;SP
311294;UNIMED DE OURINHOS COOPERATIVA DE TRABALHO MADICO;SP
361615;UNIMED DE PARANAGUA COOPERATIVA DE TRABALHO MADICO;PR
320862;UNIMED DE PARANAVAA COOPERATIVA DE TRABALHO MADICO;PR
323004;UNIMED DE PENAPOLIS COOPERATIVA DE TRABALHO MEDICO;SP
342343;UNIMED DE PINDAMONHANGABA COOPERATIVA TRABALHO MEDICO;SP
315729;UNIMED DE PIRACICABA SOCIEDADE COOPERATIVA DE SERVIAOS MADICOS;SP
314242;UNIMED DE PIRASSUNUNGA COOPERATIVA DE TRABALHO MADICO;SP
315796;UNIMED DE PRESIDENTE PRUDENTE COOPERATIVA DE TRAB MADICO;SP
351776;UNIMED DE REGISTRO COOPERATIVA DE TRABALHO MADICO;SP
351202;UNIMED DE RIBEIRAO PRETO COOPERATIVA DE TRABALHO MADICO;SP
306126;UNIMED DE RIO CLARO SP COOPERATIVA DE TRABALHO MEDICO;SP
369292;UNIMED DE SANTA BARBARA DOESTE E AMERICANA COOP DE TRABALHO MADICO;SP
355721;UNIMED DE SANTOS COOP DE TRAB MEDICO;SP
354619;UNIMED DE SAO JOSA DO RIO PARDOCOOP DE TRAB MADICO;SP
303178;UNIMED DE SOBRAL SOCIEDADE COOPERATIVA MADICA LTDA;CE
318388;UNIMED DE SAO ROQUE COOPERATIVA DE TRABALHO MADICO;SP
361941;UNIMED DE TATUI COOPERATIVA DE TRABALHO MADICO;SP
363286;UNIMED DE TAUBATA COOPERATIVA DE TRABALHO MADICO;SP
364860;UNIMED DE TUBARAO COOPERATIVA DE TRABALHO MEDICO DA REGIAO DA AMUREL;SC
365530;UNIMED DE TUPA COOPERATIVA DE TRABALHO MADICO;SP
362573;UNIMED DE UBA COOPERATIVA DE TRABALHO MEDICO;MG
364584;UNIMED DE VOLTA REDONDA COOPERATIVA DE TRABALHO MADICO;RJ
319121;UNIMED DIVINOPOLIS COOPERATIVA DE TRABALHO MEDICO LTDA;MG
300870;UNIMED DO BRASIL CONF NACIONAL DAS COOPERATIVAS MADICAS;SP
356123;UNIMED DO CARIRI SOCIEDADE COOPERATIVA MADICA LTDA;CE
321958;UNIMED DO CEARA FEDERAAAO DAS SOCIEDADES COOPERATIVAS MADICAS DO ESTADO DO CEARA LTDA;CE
312363;UNIMED DO EST DO RJ FEDERAAAO EST DAS COOPERATIVAS MADICAS;RJ
355691;UNIMED DO ESTADO DE SANTA CATARINA FED EST DAS COOP MAD;SC
319996;UNIMED DO ESTADO DE SAO PAULO FEDERAAAO ESTADUAL DAS COOP MADICAS;SP
312720;UNIMED DO ESTADO DO PARANA FEDERAAAO ESTADUAL DAS COOPERATIVAS MADICAS;PR
325082;UNIMED DO OESTE DA BAHIA COOPERATIVA DE TRABALHO MADICO;BA
350371;UNIMED DO SUDOESTE COOPERATIVA DE TRABALHO MEDICO LTDA;BA
311715;UNIMED ENCOSTA DA SERRARS SOCIEDADE COOPERATIVA DE SERVIAOS DE SAADE LTDA;RS
357022;UNIMED ERECHIM COOPERATIVA DE SERVIAOS DE SAADE LTDA;RS
340251;UNIMED EXTREMO OESTE CATARINENSE COOPERATIVA DE TRABALHO MADICO;SC
346209;UNIMED EXTREMO SUL COOPERATIVA DE TRABALHO MADICO;BA
328031;UNIMED FEDERAAAO DO ESTADO DO MATO GROSSO;MT
354783;UNIMED FRANCA SOCIEDADE COOPERATIVA DE SERVIAOS MADICOS E HOSPITALARES;SP
336858;UNIMED FRANCISCO BELTRAO COOPERATIVA DE TRABALHO MEDICO;PR
352179;UNIMED FRONTEIRA NOROESTERS COOPERATIVA DE ASSISTANCIA A SAADE LTDA;RS
371564;UNIMED FRUTAL COOPERATIVA DE TRABALHO MEDICO LTDA;MG
382876;UNIMED GOIANIA COOPERATIVA DE TRABALHO MADICO;GO
386588;UNIMED GOVERNADOR VALADARES COOP DE TRABALHO MADICO LTDA;MG
360449;UNIMED GRANDE FLORIANAPOLISCOOPERATIVA DE TRABALHO MEDICO;SC
322571;UNIMED GUARAPUAVA COOPERATIVA DE TRABALHO MADICO;PR
318035;UNIMED GUAXUPA COOPERATIVA DE TRABALHO MEDICO;MG
301124;UNIMED GURUPI COOPERATIVA DE TRABALHO MADICO;TO
304395;UNIMED INCONFIDENTES COOPERATIVA DE TRABALHO MADICO LTDA;MG
320838;UNIMED INTRAFEDERATIVA FEDERAAAO REGIONAL SUL DE MINAS;MG
335517;UNIMED ITABIRA COOPERATIVA DE TRABALHO MADICO;MG
322831;UNIMED ITAJUBA COOPERATIVA DE TRABALHO MEDICO;MG
356581;UNIMED ITAANA COOPERATIVA DE TRABALHO MADICO LTDA;MG
301060;UNIMED ITUIUTABA COOPERATIVA TRABALHO MADICO LTDA;MG
321044;UNIMED JOAO PESSOA COOPERATIVA DE TRABALHO MADICO;PB
352314;UNIMED JOAO MONLEVADE COOPERATIVA DE TRABALHO MADICO LTDA;MG
306886;UNIMED JUIZ DE FORA COOPERATIVA DE TRABALHO MADICO LTDA;MG
303267;UNIMED JUNDIAI COOPERATIVA DE TRABALHO MADICO;SP
345458;UNIMED LAVRAS COOPERATIVA DE TRABALHO MADICO;MG
386901;UNIMED LEOPOLDINA COOPERATIVA DE TRABALHO MADICO LTDA;MG
358088;UNIMED LESTE PAULISTA COOPERATIVA DE TRABALHO MADICO;SP
303356;UNIMED LITORAL COOPERATIVA DE TRABALHO MADICO LTDA;SC
300136;UNIMED LITORAL SULRS COOPERATIVA DE ASSISTANCIA A SAADE LTDA;RS
327689;UNIMED MACEIO COOPERATIVA DE TRABALHO MADICO;AL
354678;UNIMED MACHADO COOPERATIVA DE TRABALHO MEDICO;MG
352543;UNIMED MARANHAO DO SUL COOPERATIVA DE TRABALHO MADICO;MA
321087;UNIMED MARQUES DE VALENAA COOPERATIVA DE TRABALHO MADICO LTDA;RJ
301744;UNIMED MEIO OESTE CATARINENSE COOPERATIVA DE TRABALHO MADICO;SC
318566;UNIMED METROPOLITANA DO AGRESTE COOPERATIVA DE TRABALHO MADICO;AL
311618;UNIMED MISSAESRS COOPERATIVA DE ASSISTANCIA A SAADE LTDA;RS
304051;UNIMED MONTES CLAROS COOPERATIVA DE TRABALHO MADICO LTDA;MG
342157;UNIMED MORRINHOS COOPERATIVA DE TRABALHO MEDICO;GO
368148;UNIMED MURIAA COOPERATIVA DE TRABALHO MEDICO LTDA;MG
339679;UNIMED NACIONAL COOPERATIVA CENTRAL;SP
335592;UNIMED NATAL SOC COOP DE TRAB MADICO;RN
328294;UNIMED NORDESTE PAULISTA FED INTRAFEDERATIVA DAS COOP MADICAS;SP
371629;UNIMED NOROESTE CAPIXABA COOPERATIVA DE TRABALHO MADICO;ES
315494;UNIMED NOROESTE DE MINAS COOPERATIVA DE TRABALHO MEDICO LTDA;MG
365777;UNIMED NOROESTE DO PARANA COOP DE TRABALHO MADICO;PR
360414;UNIMED NOROESTE FLUMINENSE COOPERATIVA DE TRABALHO MADICO LTDA;RJ
357260;UNIMED NOROESTERS SOCIEDADE COOPERATIVA DE ASSISTANCIA A SAADE LTDA;RS
371777;UNIMED NORTE CAPIXABA COOPERATIVA DE TRABALHO MADICO;ES
353663;UNIMED NORTE DO MATO GROSSO COOPERATIVA DE TRABALHO MADICO;MT
358282;UNIMED NORTE DO PARANA COOPERATIVA REGIONAL DE TRABALHO MADICO;PR
312592;UNIMED NORTE FLUMINENSE COOPERATIVA DE TRABALHO MEDICO;RJ
323055;UNIMED NORTE PAULISTA COOPERATIVA DE TRABALHO MADICO;SP
366064;UNIMED NORTE PIONEIRO COOPERATIVA DE TRABALHO MADICO;PR
324213;UNIMED NORTENORDESTEFEDERAAAO INTERFEDERATIVA DAS SOCIEDADES COOPERATIVAS DE TRABALHO MADICO EM RECUPERAAAO JUDICIAL;PB
335479;UNIMED NOVA FRIBURGOSOCCOOPSERVMEDHOSPLTDA;RJ
344397;UNIMED NOVA IGUACU COOPERATIVA DE TRABALHO MEDICO;RJ
305227;UNIMED OESTE DO PARANA COOPERATIVA DE TRABALHO MEDICO;PR
362140;UNIMED OESTE DO PARA COOPERATIVA DE TRABALHO MADICO;PA
415014;UNIMED OS BANDEIRANTES COOPERATIVA DE TRABALHO MADICO;SP
309907;UNIMED PALMAS COOPERATIVA DE TRABALHO MADICO;TO
324523;UNIMED PARAIBA FEDERAAAO DAS SOCIEDADES COOPERATIVAS DE TRABALHO MEDICO;PB
304344;UNIMED PARA DE MINAS COOPERATIVA DE TRABALHO MADICO LTDA;MG
370681;UNIMED PATO BRANCO SOCIEDADE COOPERATIVA DE MADICOS;PR
336467;UNIMED PATOS COOPERATIVA DE TRABALHO MADICO;PB
353060;UNIMED PATOS DE MINAS COOPERATIVA TRABALHO MADICO LTDA;MG
355593;UNIMED PATROCANIO COOPERATIVA DE TRABALHO MADICO LTDA;MG
311375;UNIMED PELOTASRS COOPERATIVA DE ASSISTANCIA A SAADE LTDA;RS
323993;UNIMED PETROPOLISRJ COOPERATIVA DE TRABALHO MADICO;RJ
362832;UNIMED PLANALTO CENTRALRS COOPERATIVA DE ASSISTANCIA A SAADE LTDA;RS
319384;UNIMED PLANALTO MADIORS COOPERATIVA DE ASSISTANCIA A SAADE LTDA;RS
349712;UNIMED PONTA GROSSA COOPERATIVA DE TRABALHO MEDICO;PR
353876;UNIMED PONTAL DO TRIANGULO COOPERATIVA DE TRABALHO MADICO;MG
343722;UNIMED PONTE NOVA COOPERATIVA DE TRABALHO MEDICO LTDA;MG
352501;UNIMED PORTO ALEGRE COOPERATIVA MADICA LTDA;RS
337374;UNIMED PORTO VELHO SOCIEDADE COOPERATIVA MADICA LTDA;RO
316148;UNIMED POAOS DE CALDAS SOC COOP DE TRAB E SERVIAOS MADICOS;MG
344885;UNIMED RECIFE COOPERATIVA DE TRABALHO MADICO;PE
311847;UNIMED REGIONAL DA BAIXA MOGIANA COOPERATIVA DE TRABALHO MADICO;SP
306100;UNIMED REGIONAL DE CAMPO MOURAO COOP TRAB MEDICO;PR
316458;UNIMED REGIONAL DE FLORIANO COOPERATIVA DE TRABALHO MADICO;PI
313475;UNIMED REGIONAL DE PICOS COOPERATIVA DE TRABALHO MADICO;PI
342386;UNIMED REGIONAL DE TRES LAGOAS COOPERATIVA DE TRABALHO MADICO;MS
306762;UNIMED REGIONAL JAU COOPERATIVA DE TRABALHO MADICO;SP
371254;UNIMED REGIONAL MARINGA COOPDE TRABALHO MADICO;PR
305472;UNIMED REGIONAL SUL GOIAS COOP DE TRABALHO MADICO LTDA;GO
350648;UNIMED REGIAO DA CAMPANHARS COOPERATIVA DE ASSISTANCIA A SAADE LTDA;RS
328375;UNIMED REGIAO DA FRONTEIRA RS COOPERATIVA DE ASSISTANCIA A SAADE LTDA;RS
353698;UNIMED REGIAO DA PRODUAAORS COOPERATIVA DE ASSISTANCIA A SAADE LTDA;RS
330566;UNIMED RESENDE COOPERATIVA DE TRABALHO MADICO;RJ
337871;UNIMED RIO BRANCO COOPERATIVA DE TRABALHO MEDICO LTDA;AC
320251;UNIMED RIO VERDE COOPERATIVA TRABALHO MEDICO;GO
359777;UNIMED RONDONOPOLIS COOPERATIVA DE TRABALHO MADICO LTDA;MT
346276;UNIMED SALTOITU COOPERATIVA MADICA;SP
319708;UNIMED SANTA MARIARS COOPERATIVA DE ASSISTANCIA A SAADE LTDA;RS
331872;UNIMED SAO JOSE DOS CAMPOS COOPERATIVA DE TRABALHO MEDICO;SP
335100;UNIMED SAO JOSA DO RIO PRETO COOP DE TRABALHO MADICO;SP
416801;UNIMED SAADE E ODONTO SA;SP
701;UNIMED SEGUROS SAADE SA;SP
337668;UNIMED SERGIPE COOPERATIVA DE TRABALHO MADICO;SE
325571;UNIMED SERRA GAUCHARS COOPERATIVA DE ASSISTENCIA A SAUDE LTDA;RS
348295;UNIMED SOROCABA COOPERATIVA DE TRABALHO MADICO;SP
343153;UNIMED SOUSA COOPERATIVA DE TRABALHO MADICO;PB
324175;UNIMED SUDOESTE DE MINAS COOPERATIVA DE TRABALHO MADICO;MG
